{
  "schema_version": 1,
  "program_id": "m-000000000001",
  "feature_id": "F-MIN-01",
  "worker_run_id": "11111111-1111-1111-1111-111111111111",
  "base_sha": "0000000000000000000000000000000000000000",
  "head_sha": "0000000000000000000000000000000000000001",
  "success_state": "success",
  "criteria_addressed": ["AC-1"],
  "produced_at": "2026-05-21T00:00:00Z",
  "signature": {
    "alg": "HMAC-SHA256",
    "key_id": "k1",
    "mac": "0000000000000000000000000000000000000000000000000000000000000000"
  }
}
